{
  "schemaVersion": "1.0.0",
  "generatedAt": "2026-07-14T00:00:01.000Z",
  "generator": { "name": "UpgradeLens", "version": "0.1.1" },
  "input": {
    "projectManifest": {
      "schemaVersion": "2.0.0",
      "artifact": ".upgradelens/project-manifest.json",
      "artifactDigest": "sha256:aaaaaaaaaaaaaaaaaaaaaaaaaaaaaaaaaaaaaaaaaaaaaaaaaaaaaaaaaaaaaaaa",
      "repository": { "name": "fastapi-project", "root": "." }
    }
  },
  "policy": {
    "mode": "online",
    "policyVersion": "1",
    "registryBases": {
      "npm": "https://registry.npmjs.org",
      "pypi": "https://pypi.org"
    },
    "ttlPolicyVersion": "1",
    "sourceAllowlistVersion": "1",
    "includePrereleases": false
  },
  "research": {
    "researchId": "sha256:eeeeeeeeeeeeeeeeeeeeeeeeeeeeeeeeeeeeeeeeeeeeeeeeeeeeeeeeeeeeeeee",
    "startedAt": "2026-07-14T00:00:00.000Z",
    "completedAt": "2026-07-14T00:00:01.000Z",
    "durationMs": 1000,
    "inputOccurrenceCount": 1,
    "inputPackageCount": 1,
    "researchedPackageCount": 1,
    "sourceCount": 1,
    "cacheHitCount": 0,
    "cacheMissCount": 1,
    "cacheRevalidationCount": 0,
    "retryCount": 0,
    "partialFailureCount": 0
  },
  "summary": {
    "inputOccurrenceCount": 1,
    "packageCount": 1,
    "resolvedPackageCount": 1,
    "partialPackageCount": 0,
    "notFoundPackageCount": 0,
    "invalidPackageCount": 0,
    "unavailablePackageCount": 0,
    "sourceCount": 1,
    "warningCount": 0,
    "cacheHitCount": 0,
    "cacheMissCount": 1,
    "staleSourceCount": 0
  },
  "packages": [
    {
      "id": "pypi:fastapi",
      "ecosystem": "python",
      "status": "resolved",
      "identity": {
        "observedDeclaredNames": ["FastAPI"],
        "normalizedName": "fastapi",
        "registry": "pypi",
        "registryBaseUrl": "https://pypi.org",
        "packageUrl": "https://pypi.org/project/fastapi",
        "apiUrl": "https://pypi.org/pypi/fastapi/json"
      },
      "occurrences": [
        {
          "projectId": "python:.",
          "projectPath": ".",
          "manifest": "requirements.txt",
          "dependencyType": "runtime",
          "declaredName": "FastAPI",
          "declaredVersion": "==0.116.0"
        }
      ],
      "metadata": {
        "description": "A modern web framework for building APIs with Python.",
        "license": "MIT",
        "homepageUrl": "https://fastapi.tiangolo.com",
        "documentationUrl": "https://fastapi.tiangolo.com",
        "repositoryUrl": "https://github.com/fastapi/fastapi",
        "issueUrl": "https://github.com/fastapi/fastapi/issues",
        "deprecationMessage": null,
        "projectStatus": "Production/Stable"
      },
      "latest": {
        "version": "0.116.0",
        "selection": "project-info-version",
        "publishedAt": "2026-01-02T00:00:00.000Z",
        "releaseUrl": "https://pypi.org/project/fastapi/0.116.0",
        "prerelease": false,
        "yanked": false,
        "deprecated": false,
        "sourceId": "pypi:fastapi:registry"
      },
      "releaseIndex": [
        {
          "version": "0.116.0",
          "publishedAt": "2026-01-02T00:00:00.000Z",
          "url": "https://pypi.org/project/fastapi/0.116.0",
          "prerelease": false,
          "yanked": false,
          "deprecated": false,
          "sourceIds": ["pypi:fastapi:registry"]
        }
      ],
      "sourceIds": ["pypi:fastapi:registry"],
      "warningCodes": []
    }
  ],
  "sources": [
    {
      "id": "pypi:fastapi:registry",
      "kind": "registry",
      "authority": "registryAuthoritative",
      "trust": "publisher",
      "url": "https://pypi.org/project/fastapi",
      "apiUrl": "https://pypi.org/pypi/fastapi/json",
      "status": "available",
      "supports": ["identity", "latest", "releases"],
      "discoveredFrom": null,
      "trustEvidenceSourceIds": [],
      "snapshot": {
        "contentDigest": "sha256:ffffffffffffffffffffffffffffffffffffffffffffffffffffffffffffffff",
        "mediaType": "application/json",
        "retrievedAt": "2026-07-14T00:00:00.500Z",
        "freshness": "fresh"
      }
    }
  ],
  "cache": {
    "mode": "online",
    "policyVersion": "1",
    "hitCount": 0,
    "missCount": 1,
    "revalidationCount": 0,
    "staleEntryCount": 0
  },
  "warnings": []
}
