{
  "schemaVersion": "1.0.0",
  "generatedAt": "2026-07-14T00:00:01.000Z",
  "generator": { "name": "UpgradeLens", "version": "0.1.1" },
  "input": {
    "projectManifest": {
      "schemaVersion": "2.0.0",
      "artifact": ".upgradelens/project-manifest.json",
      "artifactDigest": "sha256:aaaaaaaaaaaaaaaaaaaaaaaaaaaaaaaaaaaaaaaaaaaaaaaaaaaaaaaaaaaaaaaa",
      "repository": { "name": "react-project", "root": "." }
    }
  },
  "policy": {
    "mode": "online",
    "policyVersion": "1",
    "registryBases": {
      "npm": "https://registry.npmjs.org",
      "pypi": "https://pypi.org"
    },
    "ttlPolicyVersion": "1",
    "sourceAllowlistVersion": "1",
    "includePrereleases": false
  },
  "research": {
    "researchId": "sha256:cccccccccccccccccccccccccccccccccccccccccccccccccccccccccccccccc",
    "startedAt": "2026-07-14T00:00:00.000Z",
    "completedAt": "2026-07-14T00:00:01.000Z",
    "durationMs": 1000,
    "inputOccurrenceCount": 1,
    "inputPackageCount": 1,
    "researchedPackageCount": 1,
    "sourceCount": 1,
    "cacheHitCount": 0,
    "cacheMissCount": 1,
    "cacheRevalidationCount": 0,
    "retryCount": 0,
    "partialFailureCount": 0
  },
  "summary": {
    "inputOccurrenceCount": 1,
    "packageCount": 1,
    "resolvedPackageCount": 1,
    "partialPackageCount": 0,
    "notFoundPackageCount": 0,
    "invalidPackageCount": 0,
    "unavailablePackageCount": 0,
    "sourceCount": 1,
    "warningCount": 0,
    "cacheHitCount": 0,
    "cacheMissCount": 1,
    "staleSourceCount": 0
  },
  "packages": [
    {
      "id": "npm:react",
      "ecosystem": "node",
      "status": "resolved",
      "identity": {
        "observedDeclaredNames": ["react"],
        "normalizedName": "react",
        "registry": "npm",
        "registryBaseUrl": "https://registry.npmjs.org",
        "packageUrl": "https://www.npmjs.com/package/react",
        "apiUrl": "https://registry.npmjs.org/react"
      },
      "occurrences": [
        {
          "projectId": "node:.",
          "projectPath": ".",
          "manifest": "package.json",
          "dependencyType": "dependency",
          "declaredName": "react",
          "declaredVersion": "^19.2.0"
        }
      ],
      "metadata": {
        "description": "React is a JavaScript library for building user interfaces.",
        "license": "MIT",
        "homepageUrl": "https://react.dev",
        "documentationUrl": "https://react.dev",
        "repositoryUrl": "https://github.com/facebook/react",
        "issueUrl": "https://github.com/facebook/react/issues",
        "deprecationMessage": null,
        "projectStatus": null
      },
      "latest": {
        "version": "19.2.0",
        "selection": "dist-tag:latest",
        "publishedAt": "2026-01-01T00:00:00.000Z",
        "releaseUrl": "https://www.npmjs.com/package/react/v/19.2.0",
        "prerelease": false,
        "yanked": false,
        "deprecated": false,
        "sourceId": "npm:react:registry"
      },
      "releaseIndex": [
        {
          "version": "19.2.0",
          "publishedAt": "2026-01-01T00:00:00.000Z",
          "url": "https://www.npmjs.com/package/react/v/19.2.0",
          "prerelease": false,
          "yanked": false,
          "deprecated": false,
          "sourceIds": ["npm:react:registry"]
        }
      ],
      "sourceIds": ["npm:react:registry"],
      "warningCodes": []
    }
  ],
  "sources": [
    {
      "id": "npm:react:registry",
      "kind": "registry",
      "authority": "registryAuthoritative",
      "trust": "publisher",
      "url": "https://www.npmjs.com/package/react",
      "apiUrl": "https://registry.npmjs.org/react",
      "status": "available",
      "supports": ["identity", "latest", "releases"],
      "discoveredFrom": null,
      "trustEvidenceSourceIds": [],
      "snapshot": {
        "contentDigest": "sha256:dddddddddddddddddddddddddddddddddddddddddddddddddddddddddddddddd",
        "mediaType": "application/json",
        "retrievedAt": "2026-07-14T00:00:00.500Z",
        "freshness": "fresh"
      }
    }
  ],
  "cache": {
    "mode": "online",
    "policyVersion": "1",
    "hitCount": 0,
    "missCount": 1,
    "revalidationCount": 0,
    "staleEntryCount": 0
  },
  "warnings": []
}
